{
  "$schema": "http://json-schema.org/draft-07/schema#",
  "$id": "https://gatos.io/schemas/v1/state/proof_of_fold_envelope.schema.json",
  "title": "Proof of Fold Envelope",
  "type": "object",
  "required": ["fold_id", "engine", "policy_root", "inputs", "output_shape_root", "metrics", "ts"],
  "properties": {
    "fold_id": { "type": "string", "pattern": "^blake3:[0-9a-f]{64}$" },
    "engine": {
      "type": "object",
      "required": ["program", "version", "platform"],
      "properties": {
        "program": { "type": "string" },
        "version": { "type": "string" },
        "platform": { "type": "string" }
      }
    },
    "policy_root": { "type": "string" },
    "inputs": {
      "type": "object",
      "required": ["events", "upstreams"],
      "properties": {
        "events": { "type": "array", "items": { "type": "string" } },
        "upstreams": { "type": "array", "items": { "type": "string" } }
      }
    },
    "output_shape_root": { "type": "string", "pattern": "^blake3:[0-9a-f]{64}$" },
    "metrics": {
      "type": "object",
      "properties": {
        "units": { "type": "integer" },
        "duration_ms": { "type": "integer" }
      }
    },
    "ts": { "type": "string", "format": "date-time" },
    "content_id": { "type": "string", "pattern": "^blake3:[0-9a-f]{64}$" }
  }
}
