{
  "fold_id": "blake3:1111111111111111111111111111111111111111111111111111111111111111",
  "engine": {
    "program": "gatos-fold@sha256:a1b2c3d4",
    "version": "1.5.0",
    "platform": "linux/amd64"
  },
  "policy_root": "abcdefabcdefabcdefabcdefabcdefabcdefabcd",
  "inputs": {
    "events": [
      "refs/gatos/journal/main/0001",
      "refs/gatos/journal/main/0002"
    ],
    "upstreams": [
      "refs/gatos/state/federated/policy@0123456789abcdef0123456789abcdef01234567"
    ]
  },
  "output_shape_root": "blake3:2222222222222222222222222222222222222222222222222222222222222222",
  "metrics": {
    "units": 12,
    "duration_ms": 845
  },
  "ts": "2025-11-17T11:58:30Z",
  "content_id": "blake3:3333333333333333333333333333333333333333333333333333333333333333"
}
